{
  "$schema": "./schemas/source-quality.schema.json",
  "schema_version": "1.0",
  "description": "Source quality tier definitions for puzzle adapters. Scale: 1=Unrated to 5=Professional.",
  "last_updated": "2026-02-18",
  "changelog": [
    {
      "version": "1.0",
      "date": "2026-02-18",
      "author": "initial",
      "changes": "Initial 5-tier source quality system."
    }
  ],

  "tiers": {
    "5": {
      "name": "Professional",
      "stars": "★★★★★",
      "description": "Pro-curated, pre-validated, excellent solution trees",
      "criteria": "Curated by professional Go players, verified solutions, rich metadata"
    },
    "4": {
      "name": "High",
      "stars": "★★★★☆",
      "description": "Well-curated, minor issues, good coverage",
      "criteria": "Quality collections from known sources, minor inconsistencies acceptable"
    },
    "3": {
      "name": "Standard",
      "stars": "★★★☆☆",
      "description": "Decent quality, needs validation, some inconsistencies",
      "criteria": "Reasonable quality, may need additional validation in pipeline"
    },
    "2": {
      "name": "Variable",
      "stars": "★★☆☆☆",
      "description": "Mixed quality, requires heavy filtering",
      "criteria": "Crowdsourced or automated, significant quality variance"
    },
    "1": {
      "name": "Unrated",
      "stars": "★☆☆☆☆",
      "description": "Default - Not yet evaluated",
      "criteria": "New sources, quality unknown, use with caution"
    }
  }
}
